Year,N_Citations,Median_5yr,Deviation,Is_Peak,Top_References
1900,8,8.0,0.0,False,"Pritchett HS, 1900, SCIENCE, V12, P657, DOI 10.1126/science.12.305.657 | [Anonymous], 1900, CODE MED ETHICS AM M, P98 | [Anonymous], 1900, ILLUSTRATED OFFICIAL"
1901,0,5.0,-5.0,False,
1902,9,2.0,7.0,False,"MAUSS M, 1902, GEN THEORY MAGIC 190 | Simmel G, 1902, AM J SOCIOL, V8, P1, DOI 10.1086/211115 | Simmel G, 1902, AM J SOCIOL, V8, P158, DOI 10.1086/211128"
1903,2,2.0,0.0,False,"JACKSON, 1903, AIEE T, V22, P600 | JACKSON, 1903, AIEE T, V22, P601"
1904,2,3.0,-1.0,False,"Brogger Waldemar Christopher, 1904, AFTENPOSTEN, V164, P1 | [Anonymous], 1904, ILLUSTRATED OFFICIAL"
1905,5,3.0,2.0,False,"Dayton H., 1905, PRACTICE MED MANUAL | Carnegie Andrew., 1905, James Watt | [Anonymous], 1905, Z VEREINES DTSCH ING, V49, P538"
1906,3,5.0,-2.0,False,"The Physical Laboratories of the University of Manchester, 1906, REC 25YEARS WOR | Jordan David Starr, 1906, Science, V24, P130 | German Universities and University Study, (1906)"
1907,12,8.0,4.0,False,"ALEXANDER MW, 1907, COMMUNICATION   0610 | ALEXANDER MW, 1907, COMMUNICATION   1222 | BALDWIN AS, 1907, COMMUNICATION   1204"
1908,8,8.0,0.0,False,"ALEXANDER MW, 1908, COMMUNICATION   0521 | ALEXANDER MW, 1908, AIEE T 2, V27, P1468 | JACKSON, 1908, COMMUNICATION   1204"
1909,8,8.0,0.0,False,"List F., 1909, NATL SYSTEM POLITICA | List F., 1909, NATL SYSTEM POLITICA | ALEXANDER MW, 1909, COMMUNICATION   0115"
1910,6,8.0,-2.0,False,"ALEXANDER MW, 1910, COMMUNICATION   0122 | SCHNEIDER H, 1910, SPEE P, V18, P395 | Baudeau Nicolas., 1910, Premiere introduction a la philosophie economique"
1911,7,7.0,0.0,False,"Taylor F.W., 1911, PRINCIPLES SCI MANAG | Taylor F.W., 1911, PRINCIPLES SCI MANAG | JACKSON, 1911, AIEE T 2, V30, P1135"
1912,41,6.0,35.0,False,"Schumpeter J.A., 1912, The Theory of Economic Development | Schumpeter J., 1912, THEORY EC DEV | Schumpeter J.A., 1912, Theorie der Wirtschaftlichen Entwichlung"
1913,2,4.0,-2.0,False,"Burton William, 1913, U.S. Patent, Patent No. [1049667, 1,049,667] | Riedler Alois, 1913, Z OSTERREICHISCHEN I, V65, P145"
1914,4,4.0,0.0,False,"[Anonymous], 1914, P ATL CIT SESS 65 AN, P73 | Foster George Carey, 1914, P ROY SOC LONDON, V91, plxiii | Teaching History of Art in European Universities and High Schools in the Light o"
1915,1,4.0,-3.0,False,"[Anonymous], 1915, MINUTES P I CIVIL EN, V200, P471"
1916,4,4.0,0.0,False,"Marshall Alfred., 1916, PRINCIPLES EC, VEighth | Brogger Waldemar Christopher, 1916, FRIDTJOF NANSENS FON | Riedler Alois, 1916, EMIL RATHENAU WERDEN, DOI [10.1007/978-3-642-94487-1, DOI 1"
1917,8,4.0,4.0,False,"Marshall Leon Carroll., 1917, Journal of Political Economy, V25, P84 | ALEXANDER MW, 1917, COMMUNICATION   0427 | DAVIS D, 1917, COMMUNICATION   0331"
1918,5,5.0,0.0,False,"VEBLEN T, 1918, HIGHER LEARNING AM, P170 | Veblen Thorstein., 1918, HIGHER LEARNING AM | ALEXANDER MW, 1918, COMMUNICATION   0130"
1919,3,8.0,-5.0,False,"[Anonymous], 1919, JAMA, P1219 | Fison A.H., 1919, J CHEM SOC T, V115, P412 | Smithsonian Institution Annual Report, (1919)"
1920,20,7.0,13.0,False,"JACKSON, 1920, COMMUNICATION   0323 | JACKSON, 1920, COMMUNICATION   0626 | JOHNSON, 1920, COMMUNICATION   0406"
1921,22,7.0,15.0,False,"Knight FrankH., 1921, UNCERTAINTY PROFIT | Knight FrankH., 1921, UNCERTAINTY PROFIT | Knight FrankH., 1921, UNCERTAINTY PROFIT"
1922,7,7.0,0.0,False,"Freud S., 1922, GROUP PSYCHOL ANAL E | Malinowski B., 1922, ARGONAUTS W PACIFIC | JACKSON, 1922, COMMUNICATION   0307"
1923,2,5.0,-3.0,False,"Sinclair Upton., 1923, The Goose-Step: A Study of American Education | TIMBIE WH, 1923, COMMUNICATION   1016"
1924,2,5.0,-3.0,False,"Lock, Koen, Development and validation of an acute biotic ligand model (BLM) pre | Legal Foundations of Capitalism, (1924)"
1925,5,5.0,0.0,False,"Eberstein Gosta, 1925, SVENSK JURISTTIDNING, V1925, P241 | TIMBIE WH, 1925, AIEE J, V44, P615 | Fisher R. A, 1925, STAT METHODS RES WOR"
1926,7,6.0,1.0,False,"Lotka A.J., 1926, Journal of the Washington Academy of Sciences, V16, P317 | Schumpeter J., 1926, THEORY EC DEV, V2d | Lotka A.J., 1926, Journal of the Washington Academy of Sciences, V16, P317"
1927,6,6.0,0.0,False,"JACKSON, 1927, COMMUNICATION   0322 | JACKSON, 1927, COMMUNICATION   1020 | Hawley FB, 1927, AM ECON REV, V17, P409"
1928,10,6.0,4.0,False,"Schumpeter J, 1928, ECON J, V38, P361, DOI 10.2307/2224315 | Schumpeter J, 1928, ECON J, V38, P361, DOI 10.2307/2224315 | Ramsey FP, 1928, ECON J, V38, P543, DOI 10.2307/2224098"
1929,2,6.0,-4.0,False,"Husserl E, 1929, CARTESIANISCHE MEDIT | JACKSON, 1929, COMMUNICATION   0304"
1930,6,6.0,0.0,False,"*SOC PROM ENGN ED, 1930, REP INV ENGN ED 1923, V1, P541 | Edgar L.J., 1930, Patent, Patent No. [1,745,175, 1745175] | Flexner Abraham, 1930, Proceedings of the American Philosophical Society, V60"
1931,4,6.0,-2.0,False,"Kahn RF, 1931, ECON J, V41, P173, DOI 10.2307/2223697 | Gibrat R., 1931, INEGALITES EC | LODGE O, 1931, PAST YEARS AUTOBIOGR"
1932,13,8.0,5.0,False,"COMPTON KT, 1932, COMMUNICATION   1122 | JACKSON, 1932, COMMUNICATION   1102 | Sevringhaus E L, 1932, Science, V76, P233, DOI 10.1126/science.76.1967.233"
1933,8,13.0,-5.0,False,"Dale HH, 1933, SCIENCE, V77, P521, DOI 10.1126/science.77.2005.521 | Flexner A, 1933, Science, V77, P325, DOI 10.1126/science.77.1996.325 | Henderson Y, 1933, Science, V77, P324, DOI 10.1126/science.77.1996.324"
1934,35,13.0,22.0,False,"Schumpeter JosephA., 1934, THEORY EC DEV | SCHUMPETER JA, 1934, THEORY EC DEV, P92 | Schumpeter JosephA., 1934, THEORY EC DEV"
1935,14,14.0,0.0,False,"Schumpeter JA, 1935, REV ECON STATISTICS, V17, P2, DOI 10.2307/1927845 | Schumpeter JA, 1935, REV ECON STATISTICS, V17, P2, DOI 10.2307/1927845 | Schumpeter JA, 1935, REV ECON STATISTICS, V17, P2, DOI 10.2307/1927845"
1936,6,14.0,-8.0,False,"Rashdall Hastings, 1936, U EUROPE MIDDLE AGE | Weidlein Edward R., 1936, GLANCES IND RES DURI | Johnson P.O., 1936, STAT RES MEMOIRS, V1, P57, DOI DOI 10.2307/302397"
1937,21,14.0,7.0,False,"Bartlett MS, 1937, B J PSYCHOL-GEN SECT, V28, P97, DOI 10.1111/j.2044-8295.1937. | Keynes JM, 1937, Q J ECON, V51, P209, DOI 10.2307/1882087 | Hughes EC, 1937, AM J SOCIOL, V43, P404, DOI 10.1086/217711"
1938,11,11.0,0.0,False,"Merton RobertK., 1938, Science, Technology and Society in Seventeenth Century En | MERTON RK, 1938, SCI TECHNOLOGY SOC 1, P165 | Dewey J., 1938, Experience and education, DOI DOI 10.1177/0022487120978152"
1939,23,11.0,12.0,False,"Schumpeter J.A., 1939, BUSINESS CYCLES, VI. | Pace CR, 1939, J APPL PSYCHOL, V23, P388, DOI 10.1037/h0063286 | Schumpeter J.A., 1939, BUSINESS CYCLES, VI."
1940,8,11.0,-3.0,False,"Potter AA, 1940, SCIENCE, V91, P1, DOI 10.1126/science.91.2349.1 | WADDINGTON C. H., 1940 | RASHEVSKY N., 1940, BULL MATH BIOPHYS, V2, P15, DOI 10.1007/BF02478028"
1941,2,10.0,-8.0,False,"Schumpeter J. A., 1941, Joseph A. Schumpeter: The Economics and Sociology of Cap | Managerial Revolution, (1941)"
1942,17,10.0,7.0,False,"Merton R.K., 1942, J LEGAL POLITIC SOCI | Merton Robert., 1942, The Normative Structure of Science, The Sociology of Scien | Hempel C.G., 1942, J PHILOS, P35, DOI [10.2307/2017635, DOI 10.2307/2017635]"
1943,10,13.0,-3.0,False,"Maslow AH, 1943, PSYCHOL REV, V50, P370, DOI 10.1037/h0054346 | Leavis F. R., 1943, ED U, P120 | PARK CW, 1943, AMBASSADOR IND IDEA, P45"
1944,13,17.0,-4.0,False,"von Mises Ludwig., 1944, BUREAUCRACY, V1st | Motion AK, 1944, ANGAENDE FORBTTRANDE | Motion FK, 1944, ATGARDER FRAMJANDE M"
1945,49,26.0,23.0,False,"Bush Vannevar., 1945, SCI THE ENDLESS FRON | Bush Vannevar., 1945, Science, the Endless Frontier: A Report to the President | Bush Vannevar., 1945, Science, the Endless Frontier: A Report to the President"
1946,26,26.0,0.0,False,"Lewin K, 1946, J SOC ISSUES, V2, P34, DOI 10.1111/j.1540-4560.1946.tb02295.x | Cronbach LJ, 1946, EDUC PSYCHOL MEAS, V6, P475, DOI 10.1177/001316444600600405 | Weber M., 1946, M WEBER ESSAYS SOCIO, P77"
1947,29,26.0,3.0,False,"Lewin K, 1947, HUM RELAT, V1, P5, DOI 10.1177/001872674700100103 | Simon H.A., 1947, ADM BEHAV | Schumpeter JA, 1947, J ECON HIST, V7, P149, DOI 10.1017/S0022050700054279"
1948,24,26.0,-2.0,False,"WEBER M, 1948, BUREAUCRACY M WEBER, P196 | Lasswell HaroldD., 1948, COMMUNICATION IDEAS, P37, DOI DOI 10.1111/OLI.12148 | SHANNON CE, 1948, BELL SYST TECH J, V27, P379, DOI 10.1002/j.1538-7305.1948.tb01"
1949,19,26.0,-7.0,False,"Weber Max., 1949, METHODOLOGY SOCIAL S | Weber Max., 1949, METHODOLOGY SOCIAL S | SCHUMPETER J, 1949, ESSAYS EC TOPICS JA, P255"
1950,26,24.0,2.0,False,"Alchian AA, 1950, J POLIT ECON, V58, P211, DOI 10.1086/256940 | Dennemark Sigurd, 1950, RATTEN ARBETSTAGARES | Schmitt Carl., 1950, NOMOS EARTH INT LAW"
1951,35,20.0,15.0,False,"Cronbach LJ, 1951, PSYCHOMETRIKA, V16, P297 | Schumpeter J., 1951, Essays of Economic Topics of J A Schumpeter | CRONBACH L. J., 1951, PSYCHOMETRIKA, V16, P297, DOI [10.1007/bf02310555, DOI 10."
1952,20,26.0,-6.0,False,"STORR R, 1952, BEGINNINGS GRADUATE | STORR R, 1952, BEGINNINGS GRADUATE | JONES LV, 1952, PSYCHOL BULL, V49, P43, DOI 10.1037/h0056832"
1953,11,24.0,-13.0,False,"Burns E., 1953, DS JORDAN PROPHET FR | Stephenson W., 1953, STUDY BEHAV Q TECHNI | Burns E., 1953, DS JORDAN PROPHET FR"
1954,34,24.0,10.0,False,"FLANAGAN JC, 1954, PSYCHOL BULL, V51, P327, DOI 10.1037/h0061470 | Gouldner AlvinW., 1954, PATTERNS IND BUREAUC, DOI DOI 10.1002/smj.4250171110 | Gouldner A., 1954, PATTERNS IND DEMOCRA"
1955,24,34.0,-10.0,False,"Penrose E, 1955, AM ECON REV, V45, P531 | Metzger W.P., 1955, ACAD FREEDOM AGE U | Metzger W.P., 1955, ACAD FREEDOM AGE U"
1956,36,36.0,0.0,False,"SOLOW RM, 1956, Q J ECON, V70, P65, DOI 10.2307/1884513 | SOLOW RM, 1956, Q J ECON, V70, P65, DOI 10.2307/1884513 | SOLOW RM, 1956, Q J ECON, V70, P65, DOI 10.2307/1884513"
1957,52,52.0,0.0,False,"KIMMEL HD, 1957, PSYCHOL BULL, V54, P351, DOI 10.1037/h0046737 | Anthony Downs., 1957, An economic theory of democracy | Alderson Wroe., 1957, MARKETING BEHAV EXEC"
1958,52,52.0,0.0,False,"March J.G., 1958, Organizations, DOI DOI 10.2307/2390654 | [Anonymous], 1958, ART EXPERIENCE | Frye Northrop, 1958, ANATOMY CRITICISM"
1959,59,52.0,7.0,False,"LINDBLOM CE, 1959, PUBLIC ADMIN REV, V19, P79, DOI 10.2307/973677 | Snow C.P., 1959, The Rede Lecture 1959 | KORNHAUSER W, 1959, SCI IND CONFLICT ACC"
1960,29,52.0,-23.0,False,"PENROSE ET, 1960, BUS HIST REV, V34, P1, DOI 10.2307/3111776 | Parsons T., 1960, Structure and process in modern societies | Marcson S., 1960, The scientist in American industry"
1961,45,59.0,-14.0,False,"McClelland D., 1961, ACHIEVING SOC | McClelland D., 1961, ACHIEVING SOC | Marshall J, 1961, AM HIGHER ED DOCUMEN, P213"
1962,123,68.0,55.0,False,"ARROW KJ, 1962, REV ECON STUD, V29, P155, DOI 10.2307/2295952 | BECKER GS, 1962, J POLIT ECON, V70, P9, DOI 10.1086/258724 | Arrow K., 1962, The rate and direction of inventive activity: Economic and socia"
1963,69,69.0,0.0,False,"Cyert R., 1963, BEHAV THEORY FIRM | WUSTENHAGEN R, 1963, INTERNATIONAL JOURNA, V34, P63 | Almond G., 1963, CIVIC CULT"
1964,68,69.0,-1.0,False,"Blau P., 1964, EXCHANGE POWER SOC | David F.B., 1964, Educational Measurements and Their Interpretation | Ellul Jacques., 1964, TECHNOLOGICAL SOC"
1965,103,69.0,34.0,False,"ALLISON D, 1965, INT SCI TECHNOLOGY, V40, P22 | Stinchcombe A., 1965, HDB ORG, P142, DOI DOI 10.1016/S0742-3322(00)17019-6 | Stinchcombe A., 1965, HDB ORG, P142, DOI DOI 10.1016/S0742-3322(00)17019-6"
1966,66,101.0,-35.0,False,"BENDAVID J, 1966, AM SOCIOL REV, V31, P451, DOI 10.2307/2090769 | Schmookler J., 1966, Invention and Economic Growth | Artz Frederick., 1966, The Development of Technical Education in France, 1500-18"
1967,101,101.0,0.0,False,"DEUTERMAN E, 1967, WALL STREET J   0313 | Glaser BG., 1967, DISCOV GROUNDED THEO | Lukacs Georg., 1967, History and Class Consciousness"
1968,110,101.0,9.0,False,"TERREBERRY S, 1968, ADMIN SCI QUART, V12, P590, DOI 10.2307/2391535 | [Anonymous], 1968, ACAD REVOLUTION | [Anonymous], 1968, ACAD REVOLUTION"
1969,65,101.0,-36.0,False,"Doctors SI., 1969, ROLE FEDERAL AGENCIE | Jencks Christopher., 1969, ACAD REVOLUTION | Jacobs Jane., 1969, EC CITIES"
1970,108,98.0,10.0,False,"Kuyel Mubahat Turker, 1970, ARASTIRMA ANKARA U D, V8, P187 | SHIMSHONI D, 1970, MINERVA, V8, P59, DOI 10.1007/BF01553199 | Foucault Michel., 1970, ORDER THINGS ARCHAEO, DOI [10.4324/9781315660301, DOI 10"
1971,98,98.0,0.0,False,"Byrne D., 1971, ATTRACTION PARADIGM | Cooper A.C., 1971, FOUNDING TECHNOLOGIC | CSIKSZEN.M, 1971, AM ANTHROPOL, V73, P45, DOI 10.1525/aa.1971.73.1.02a00040"
1972,90,108.0,-18.0,False,"PFEFFER J, 1972, ADMIN SCI QUART, V17, P218, DOI 10.2307/2393956 | KAST FE, 1972, ACAD MANAGE J, V15, P447, DOI 10.5465/255141 | Crane D., 1972, Invisible College: Diffusion of Knowledge in Scientific Communit"
1973,178,98.0,80.0,False,"Kirzner I., 1973, COMPETITION ENTREPRE | BIGLAN A, 1973, J APPL PSYCHOL, V57, P195, DOI 10.1037/h0034701 | SMALL H, 1973, J AM SOC INFORM SCI, V24, P265, DOI 10.1002/asi.4630240406"
1974,139,139.0,0.0,False,"Valedin J., 1974, PRODUKTUTVECKLING MA | ROTHWELL R, 1974, RES POLICY, V3, P258, DOI 10.1016/0048-7333(74)90010-9 | GEISSER S, 1974, BIOMETRIKA, V61, P101, DOI 10.2307/2334290"
1975,94,140.0,-46.0,False,"Becker G.S., 1975, HUMAN CAPITAL, V2nd | Rossiter Margaret., 1975, The Emergence of Agricultural Science: Justus Liebig a | Rossiter Margaret., 1975, The Emergence of Agricultural Science: Justus Liebig a"
1976,140,140.0,0.0,False,"JENSEN MC, 1976, J FINANC ECON, V3, P305, DOI 10.1016/0304-405X(76)90026-X | Filley A.C., 1976, Managerial process and organizational behavior | NORBERG A, 1976, P IEEE, V64"
1977,258,195.0,63.0,False,"HANNAN MT, 1977, AM J SOCIOL, V82, P929, DOI 10.1086/226424 | HANNAN MT, 1977, AM J SOCIOL, V82, P929, DOI 10.1086/226424 | MEYER JW, 1977, AM J SOCIOL, V83, P340, DOI 10.1086/226550"
1978,195,210.0,-15.0,False,"Pfeffer J.Salancik., 1978, EXTERNAL CONTROL ORG, DOI DOI 10.2307/2392573 | Nunnally J.C., 1978, PSYCHOMETRIC THEORY, V2nd | Katz D., 1978, The social psychology of organizations, V2nd, DOI DOI 10.2307/298"
1979,242,242.0,0.0,False,"Kirzner Israel., 1979, PERCEPTION OPPORTUNI | HOLMSTROM B, 1979, BELL J ECON, V10, P74, DOI 10.2307/3003320 | Birch D.L., 1979, JOB GENERATION PROCE"
1980,210,242.0,-32.0,False,"Conover W., 1980, PRACTICAL NONPARAMET, V2nd | FOX J, 1980, SOCIOL METHOD RES, V9, P3, DOI 10.1177/004912418000900101 | Schlenker B.R., 1980, Impression management: The self-concept, social identity, "
1981,244,244.0,0.0,False,"STIGLITZ J, 1981, AM ECON REV, V71, P303 | Shaw M.E., 1981, GROUP DYNAMICS PSYCH | BIRCH DL, 1981, PUBLIC INTEREST, P3"
1982,309,302.0,7.0,False,"Tajfel Henri., 1982, SOCIAL IDENTITY INTE | DOSI G, 1982, RES POLICY, V11, P147, DOI 10.1016/0048-7333(82)90016-6 | Galbraith Jay., 1982, Journal of Business Strategy, V3, P70, DOI [DOI 10.1108/EB"
1983,482,309.0,173.0,False,"OLKEN H, 1983, 1983 P IEEE C ENG MA | DESHPANDE R, 1983, J MARKETING, V47, P101, DOI 10.2307/1251403 | FREEMAN J, 1983, AM SOCIOL REV, V48, P692, DOI 10.2307/2094928"
1984,302,403.0,-101.0,False,"OAKEY RP, 1984, OMEGA-INT J MANAGE S, V12, P113, DOI 10.1016/0305-0483(84)90030- | TYEBJEE TT, 1984, MANAGE SCI, V30, P1051, DOI 10.1287/mnsc.30.9.1051 | Rogers E.M., 1984, SILICON VALLEY FEVER"
1985,403,426.0,-23.0,False,"MacMillan I., 1985, J BUS VENTURING, V1, P119, DOI [10.1016/0883-9026(85)90011-4 | *BATT MEM I, 1985, U HIGH TECHN DEY | GIBB J.M., 1985, SCI PARKS INNOVATION"
1986,558,426.0,132.0,False,"SMILOR R, 1986, RES MANAGEMENT   MAY | TEECE DJ, 1986, RES POLICY, V15, P285, DOI 10.1016/0048-7333(86)90027-2 | TUSHMAN M, 1986, ADM SCI Q, V31, P604"
1987,426,558.0,-132.0,False,"MACMILLAN IC, 1987, J BUS VENTURING, V2, P123, DOI 10.1016/0883-9026(87)90003-6 | DOUTRIAUX J, 1987, J BUS VENTURING, V2, P285, DOI 10.1016/0883-9026(87)90022-X | GANDER JP, 1987, TECHNOL FORECAST SOC, V31, P117, DOI 10.1016/0040-1625(87)90044"
1988,664,664.0,0.0,False,"ABETTI PA, 1988, CREATING TECHNOPOLIS | ALLEN DN, 1988, APR C U SPIN OFF COR | BOPP GR, 1988, FEDERAL LAB TECHNOLO"
1989,775,775.0,0.0,False,"KEELEY RH, 1989, FRONTIERS ENTREPRENE, P274 | MACMILLAN IC, 1989, J BUS VENTURING, V4, P27, DOI 10.1016/0883-9026(89)90032-3 | WOOD R, 1989, ACAD MANAGE REV, V14, P361, DOI 10.2307/258173"
1990,910,775.0,135.0,False,"ANDERSON N, 1990, J OCCUP PSYCHOL, V63, P63, DOI 10.1111/j.2044-8325.1990.tb0051 | SAHLMAN WA, 1990, J FINANC ECON, V27, P473, DOI 10.1016/0304-405X(90)90065-8 | SMILOR RW, 1990, J BUS VENTURING, V5, P63, DOI 10.1016/0883-9026(90)90027-Q"
1991,1117,864.0,253.0,False,"JACKSON SE, 1991, J APPL PSYCHOL, V76, P675, DOI 10.1037/0021-9010.76.5.675 | Lam S.S., 1991, Journal of Business Finance Accounting, V18, P137 | HAGEDOORN J, 1991, TECHNOVATION, V11, P429, DOI 10.1016/0166-4972(91)90024-X"
1992,713,910.0,-197.0,False,"BAGOZZI RP, 1992, MULTIVAR BEHAV RES, V27, P601, DOI 10.1207/s15327906mbr2704_6 | GIST ME, 1992, ACAD MANAGE REV, V17, P183, DOI 10.2307/258770 | GUPTA AK, 1992, J BUS VENTURING, V7, P347, DOI 10.1016/0883-9026(92)90012-G"
1993,864,1117.0,-253.0,False,"HALL J, 1993, J BUS VENTURING, V8, P25, DOI 10.1016/0883-9026(93)90009-T | KIM MS, 1993, J COMMUN, V43, P101, DOI 10.1111/j.1460-2466.1993.tb01251.x | HAGEDOORN J, 1993, STRATEGIC MANAGE J, V14, P371, DOI 10.1002/smj.4250140505"
1994,1173,1124.0,49.0,False,"*EC, 1994, EUR REP S T IND | FRIED VH, 1994, FINANC MANAGE, V23, P28, DOI 10.2307/3665619 | BIDAULT F, 1994, R&D MANAGE, V24, P33, DOI 10.1111/j.1467-9310.1994.tb00845.x"
1995,1124,1173.0,-49.0,False,"ELANGO B, 1995, J BUS VENTURING, V10, P157, DOI 10.1016/0883-9026(94)00019-Q | GOMPERS PA, 1995, J FINANC, V50, P1461, DOI 10.1111/j.1540-6261.1995.tb05185.x | MURRAY GC, 1995, RES POLICY, V24, P283, DOI 10.1016/0048-7333(93)00767-N"
1996,1432,1432.0,0.0,False,"Muzyka D, 1996, J BUS VENTURING, V11, P273, DOI 10.1016/0883-9026(95)00126-3 | Eisenhardt KM, 1996, ORGAN SCI, V7, P136, DOI 10.1287/orsc.7.2.136 | Mitchell W, 1996, STRATEGIC MANAGE J, V17, P169, DOI 10.1002/(SICI)1097-0266(199"
1997,1632,1432.0,200.0,False,"Gimeno J, 1997, ADMIN SCI QUART, V42, P750, DOI 10.2307/2393656 | Sweeting RC, 1997, J MANAGE STUD, V34, P125, DOI 10.1111/1467-6486.00045 | Westhead P., 1997, Applied Financial Economics, V7, P197, DOI [10.1080/096031097"
1998,2310,1632.0,678.0,True,"Amit R, 1998, J BUS VENTURING, V13, P441, DOI 10.1016/S0883-9026(97)00061-X | Bergemann D, 1998, J BANK FINANC, V22, P703, DOI 10.1016/S0378-4266(98)00017-X | Berger AN, 1998, J BANK FINANC, V22, P613, DOI 10.1016/S0378-4266(98)00038-7"
1999,1423,2310.0,-887.0,False,"Gompers P., 1999, VENTURE CAPITAL CYCL | Lerner J, 1999, J BUS, V72, P285, DOI 10.1086/209616 | Murray G., 1999, VENTUR CAP, V1, P351, DOI DOI 10.1080/136910699295857"
2000,3314,3055.0,259.0,False,"GILL D, 2000, FUNDING TECHNOLOGY L | Hellmann T, 2000, REV FINANC STUD, V13, P959, DOI 10.1093/rfs/13.4.959 | Kortum S, 2000, RAND J ECON, V31, P674, DOI 10.2307/2696354"
2001,3055,3314.0,-259.0,False,"Franklin S.J., 2001, J TECHNOL TRANSFER, V26, P127, DOI [10.1023/A:1007896514609 | Gompers P, 2001, J ECON PERSPECT, V15, P145, DOI 10.1257/jep.15.2.145 | Kaplan SN, 2001, AM ECON REV, V91, P426, DOI 10.1257/aer.91.2.426"
2002,3339,3339.0,0.0,False,"Hellmann T, 2002, J FINANC, V57, P169, DOI 10.1111/1540-6261.00419 | Lockett A, 2002, RES POLICY, V31, P1009, DOI 10.1016/S0048-7333(01)00174-3 | Manigart S, 2002, J BUS VENTURING, V17, P291, DOI 10.1016/S0883-9026(00)00067-7"
2003,4614,4395.0,219.0,False,"Christensen C.M., 2003, INNOVATORS SOLUTION | *EUR COMM, 2003, RAIS EU R D INT RISK | Greene W.H., 2003, ECONOMETRIC ANAL, V5th"
2004,4395,4549.0,-154.0,False,"Danneels E, 2004, J PROD INNOVAT MANAG, V21, P246, DOI 10.1111/j.0737-6782.2004. | Di Giacomo M., 2004, The Journal of Private Equity, V8, P22 | Mason C., 2004, Venture Capital: An International Journal of Entrepreneurial Fin"
2005,4984,4614.0,370.0,True,"Colombo MG, 2005, RES POLICY, V34, P795, DOI 10.1016/j.respol.2005.03.010 | Dimov DP, 2005, J BUS VENTURING, V20, P1, DOI 10.1016/j.jbusvent.2003.12.007 | Ensley MD, 2005, RES POLICY, V34, P1091, DOI 10.1016/j.respol.2005.05.008"
2006,4549,4739.0,-190.0,False,"Cumming D, 2006, ENTREP THEORY PRACT, V30, P155, DOI 10.1111/j.1540-6520.2006.00 | Franke N, 2006, J BUS VENTURING, V21, P802, DOI 10.1016/j.jbusvent.2005.07.001 | Knockaert M, 2006, INT J TECHNOL MANAGE, V34, P7, DOI 10.1504/IJTM.2006.009445"
2007,5731,4739.0,992.0,True,"Clarysse B, 2007, IND CORP CHANGE, V16, P609, DOI 10.1093/icc/dtm019 | Clarysse B, 2007, SMALL BUS ECON, V29, P243, DOI 10.1007/s11187-006-9033-y | de Bettignies JE, 2007, J BUS VENTURING, V22, P808, DOI 10.1016/j.jbusvent.2006."
2008,4739,4739.0,0.0,False,"Bottazzi L, 2008, J FINANC ECON, V89, P488, DOI 10.1016/j.jfineco.2007.09.003 | Franke N, 2008, ENTREP THEORY PRACT, V32, P459, DOI 10.1111/j.1540-6520.2008.002 | VANDEVELDE E, 2008, ENTREPRENEURIAL ORIG"
2009,4541,4994.0,-453.0,False,"Lichtenthaler U, 2009, R&D MANAGE, V39, P38, DOI 10.1111/j.1467-9310.2008.00522. | Wincent J, 2009, R&D MANAGE, V39, P55, DOI 10.1111/j.1467-9310.2008.00539.x | [孙建 SUN Jian], 2009, [科学学研究, Studies in Science of Science], V27, P133"
2010,4994,4847.0,147.0,False,"Adner R, 2010, STRATEGIC MANAGE J, V31, P306, DOI 10.1002/smj.821 | Lubik S., 2010, COMMERCIALIZING ADV | Minshall T, 2010, RES TECHNOL MANAGE, V53, P53, DOI 10.1080/08956308.2010.116576"
2011,5908,4994.0,914.0,True,"Dai YX, 2011, NEW HORIZ ENTREP, P223 | Yin R.K., 2011, QUALITATIVE RES STAR | Golovko E, 2011, J INT BUS STUD, V42, P362, DOI 10.1057/jibs.2011.2"
2012,4847,5455.0,-608.0,False,"Maine E, 2012, TECHNOVATION, V32, P179, DOI 10.1016/j.technovation.2011.10.003 | Efrat K, 2012, J WORLD BUS, V47, P675, DOI 10.1016/j.jwb.2012.01.015 | Berman ElizabethPopp., 2012, Creating the Market University: How Academic Scienc"
2013,5455,5619.0,-164.0,False,"Alon I, 2013, THUNDERBIRD INT BUS, V55, P495, DOI 10.1002/tie.21566 | Alvarez SA, 2013, ORGAN SCI, V24, P301, DOI 10.1287/orsc.1110.0727 | Cruz AD, 2013, ENTREP THEORY PRACT, V37, P17, DOI 10.1111/j.1540-6520.2012.00534"
2014,5619,5619.0,0.0,False,"Bolzani D., 2014, 15 YEARS ACAD ENT IT | Casillas JC, 2014, J INT BUS STUD, V45, P85, DOI 10.1057/jibs.2013.29 | Ciravegna L, 2014, J BUS RES, V67, P1081, DOI 10.1016/j.jbusres.2013.06.002"
2015,5744,5619.0,125.0,False,"Cavusgil ST, 2015, J INT BUS STUD, V46, P3, DOI 10.1057/jibs.2014.62 | Felzensztein C, 2015, J SMALL BUS MANAGE, V53, P145, DOI 10.1111/jsbm.12188 | Joshi MP, 2015, DECISION SCI, V46, P367, DOI 10.1111/deci.12126"
2016,5856,5619.0,237.0,False,"Evers N, 2016, J INT ENTREP, V14, P285, DOI 10.1007/s10843-016-0188-6 | Knight GA, 2016, J WORLD BUS, V51, P93, DOI 10.1016/j.jwb.2015.08.011 | Love JH, 2016, INT BUS REV, V25, P806, DOI 10.1016/j.ibusrev.2015.10.001"
2017,5511,5511.0,0.0,False,"Azar G, 2017, INT BUS REV, V26, P324, DOI 10.1016/j.ibusrev.2016.09.002 | Gupta VK, 2017, J ENTREP, V26, P51, DOI 10.1177/0971355716677389 | Siegel D., 2017, WORLD SCI REFERENCE"
2018,5467,5467.0,0.0,False,"Kriz A, 2018, J INT BUS STUD, V49, P496, DOI 10.1057/s41267-018-0147-7 | Neves M, 2018, R&D MANAGE, V48, P505, DOI 10.1111/radm.12231 | Ciravegna L, 2018, INT BUS REV, V27, P1200, DOI 10.1016/j.ibusrev.2018.05.002"
2019,5406,5406.0,0.0,False,"François V, 2019, J TECHNOL TRANSFER, V44, P1188, DOI 10.1007/s10961-017-9648-y | Furlan A, 2019, J SMALL BUS MANAGE, V57, P679, DOI 10.1111/jsbm.12427 | Mathisen MT, 2019, J TECHNOL TRANSFER, V44, P1891, DOI 10.1007/s10961-018-09714-"
2020,4439,4439.0,0.0,False,"Guo F, 2020, INT J PROD ECON, V229, DOI 10.1016/j.ijpe.2020.107780 | Henley A, 2020, INT SMALL BUS J, V38, P337, DOI 10.1177/0266242619893938 | Magistretti S, 2020, TECHNOL FORECAST SOC, V151, DOI 10.1016/j.techfore.2019.119"
2021,4091,4091.0,0.0,False,"Bahl M, 2021, J WORLD BUS, V56, DOI 10.1016/j.jwb.2020.101150 | Baier-Fuentes H, 2021, TECHNOL FORECAST SOC, V163, DOI 10.1016/j.techfore.2020.1 | Miller K, 2021, STUD HIGH EDUC, V46, P915, DOI 10.1080/03075079.2021.1896799"
2022,2801,2801.0,0.0,False,"Cunningham JA, 2022, SMALL BUS ECON, V59, P11, DOI 10.1007/s11187-021-00513-5 | Liao YK, 2022, INT ENTREP MANAG J, V18, P1623, DOI 10.1007/s11365-022-00803-8 | Messina L, 2022, TECHNOL FORECAST SOC, V174, DOI 10.1016/j.techfore.2021.121257"
2023,1716,1716.0,0.0,False,"Messina L, 2023, J SMALL BUS MANAGE, V61, P3192, DOI 10.1080/00472778.2021.19895 | Jie SJ, 2023, J SMALL BUS MANAGE, V61, P1143, DOI 10.1080/00472778.2021.1955124 | Abakah E. J., 2023, SUSTAINABILITY, V15"
2024,1026,1371.0,-345.0,False,"Bettenhausen C., 2024, CHEM ENG NEWS, V102 | Pilapitiya PGCNT, 2024, CLEAN MATER, V11, DOI 10.1016/j.clema.2024.100220 | Zibunas C, 2024, COMPUT CHEM ENG, V187, DOI 10.1016/j.compchemeng.2024.108721"
2025,248,1026.0,-778.0,False,"Abbas AF., 2025, Journal of the International Council for Small Business, P1 | Abbas AF, 2025, J INT COUNC SMALL BU, V6, P865, DOI 10.1080/26437015.2025.245714 | Fayad AAS, 2025, CORP GOV-INT J BUS S, V25, P252, DOI 10.1108/CG-07-2023-0310"
